{
  "schema_version": "agent_prompt_role_contract_manifest_v2",
  "private_prompt_repository": "haphap/MOSAIC-Prompts",
  "private_prompt_branch": "codex/knot-prompt-optimizer-simplification-private",
  "private_prompt_commit": "8a32a5ce6edca081828a6708dcae3fbfa9873b6f",
  "prompt_tree_sha256": "009534b391ceb3f16db4eceedaea64b0abede6f85bb53ca59dfae8ab21342ef6",
  "execution_behavior_release_id": "execution-behavior-release:1091055e5b959c13a93e38816a532f1be711d2bf70d47d3708b82062a87e79c7",
  "execution_behavior_release_hash": "sha256:5123d6463664903a4f3cac723b6bc9f230d1438274c4050151c2646866ae2b34",
  "cohorts": [
    "cohort_bull_2007",
    "cohort_bull_2016",
    "cohort_crisis_2008",
    "cohort_crisis_covid",
    "cohort_default",
    "cohort_euphoria_2021",
    "cohort_rate_tightening",
    "cohort_recovery_2020"
  ],
  "languages": [
    "en",
    "zh"
  ],
  "agents": [
    "china",
    "us_economy",
    "eu_economy",
    "central_bank",
    "us_financial_conditions",
    "euro_area_financial_conditions",
    "commodities",
    "geopolitical",
    "market_breadth",
    "institutional_flow",
    "semiconductor",
    "technology",
    "energy",
    "biotech",
    "consumer",
    "industrials",
    "real_estate_construction",
    "financials",
    "agriculture",
    "relationship_mapper",
    "druckenmiller",
    "munger",
    "burry",
    "ackman",
    "cro",
    "alpha_discovery",
    "autonomous_execution",
    "cio"
  ],
  "agent_count": 28,
  "cohort_count": 8,
  "prompt_count": 448,
  "tombstoned_macro_agents": [
    {
      "agent": "dollar",
      "status": "legacy_unverified"
    },
    {
      "agent": "yield_curve",
      "status": "legacy_unverified"
    },
    {
      "agent": "volatility",
      "status": "legacy_unverified"
    },
    {
      "agent": "emerging_markets",
      "status": "legacy_unverified"
    },
    {
      "agent": "news_sentiment",
      "status": "legacy_unverified"
    }
  ]
}
